{
  "inputs": [
    {"source":"bank-a","revision":"cabec31f5a750b3ac7d0ae1be59d32bef4bbf918","sha256":"dd7d48b26250e8a3a293103f33c4a7bb232bf1cde123455fa1dfd21bd476d376"},
    {"source":"bank-b","revision":"c821ad99fb4edbf6fc92967a198db784e034b2d2","sha256":"cf5b9e678550c375093ea1bf38360bd83308643b4e6744c7885373aa6b39b0f2"},
    {"source":"bank-c","revision":"a30341be00484d3de6b65869998100ccc6db6945","sha256":"cd87db6a1e48cf372cec0a7d5fe1dbd4e2a02be425b69256b6ef06fa047a125a"},
    {"source":"bank-d","revision":"265e9e227581357efb87ed7217381f8a40c5e2bf","sha256":"d270691db672f863fbcddfdf51fbef9637884b227870a1576479b3ab22095d34"},
    {"source":"bank-e","revision":"5fafa709315a25ddc3b9925f8471f84b7121e2fc","sha256":"ef0e10ef42e9057f94932bcd73211573f88aeec6cd7055c7e377845f9ff389ad"},
    {"source":"bank-f","revision":"record revision 2","sha256":"528d5745837833e9998a425633ed8a7193449c584a1ca4bab8e0f9c133d0fe18"},
    {"source":"bank-f","revision":"record revision 2","sha256":"abde9142c44ebbf58e69e3cc8feec53c41adb829be48173d71afe9b579559dd9"},
    {"source":"bank-f","revision":"record revision 2","sha256":"011104369c19004afbd04646d255925d3d7bbb90cbae6f2c4b74005acfb5043b"},
    {"source":"bank-f","revision":"record revision 2","sha256":"8fbaba7db165ea46e465fe117822d7e37c4d90f07fb528078103de2f11e59a00"},
    {"source":"bank-f","revision":"record revision 2","sha256":"8882fe0ea98f1f7c98b1b37d2d821729900ec37faafffa117df4b56558a5ed58"},
    {"source":"bank-f","revision":"record revision 2","sha256":"02fd7b89c29e8a51b136a2e27c73228ccac9cabc86812b6c1385211e7e822350"},
    {"source":"sound-tags","revision":"5c427d91b3d6a7624941149ece874850b222c838","sha256":"fdc81269e2ddcf0bffffc05f01c55509d9c772f43b90f6d96fac325f9facdc8d"},
    {"source":"captions","revision":"0a51889b340037bb75a9a0858af2e4ece21f7f89","sha256":"8cc109ac507b5e5aed8ea73a5c8f897a9d0793f7397427e000adf4c05f6021c7"}
  ],
  "tools": {"python":"3.14.7","numpy":"2.5.4","pyarrow":"26.0.0"},
  "presets": 9921,
  "banks": {"bank-e":274,"bank-d":260,"bank-f":2213,"bank-a":626,"bank-c":3561,"bank-b":2987},
  "sounds": 72997,
  "uploaders": 2229,
  "captions": 1032,
  "describing": [
    {"word":"simple","preset_hits":71,"banks":5,"uploaders":212,"sounds":1191,"captions":130,"score":0.2088,"rank":1,"tier":"W1"},
    {"word":"analog","preset_hits":90,"banks":6,"uploaders":341,"sounds":43781,"captions":13,"score":0.1927,"rank":2,"tier":"W1"},
    {"word":"digital","preset_hits":38,"banks":6,"uploaders":319,"sounds":3961,"captions":182,"score":0.189,"rank":3,"tier":"W1"},
    {"word":"dark","preset_hits":50,"banks":6,"uploaders":324,"sounds":1968,"captions":27,"score":0.1664,"rank":4,"tier":"W1"},
    {"word":"soft","preset_hits":52,"banks":5,"uploaders":123,"sounds":547,"captions":96,"score":0.1526,"rank":5,"tier":"W1"},
    {"word":"deep","preset_hits":47,"banks":5,"uploaders":209,"sounds":673,"captions":28,"score":0.1383,"rank":6,"tier":"W1"},
    {"word":"fast","preset_hits":22,"banks":4,"uploaders":118,"sounds":387,"captions":192,"score":0.1342,"rank":7,"tier":"W1"},
    {"word":"short","preset_hits":21,"banks":4,"uploaders":285,"sounds":2713,"captions":62,"score":0.1329,"rank":8,"tier":"W1"},
    {"word":"distorted","preset_hits":43,"banks":4,"uploaders":157,"sounds":704,"captions":38,"score":0.1213,"rank":9,"tier":"W1"},
    {"word":"slow","preset_hits":17,"banks":5,"uploaders":129,"sounds":735,"captions":117,"score":0.1134,"rank":10,"tier":"W1"},
    {"word":"groovy","preset_hits":1,"banks":1,"uploaders":55,"sounds":122,"captions":244,"score":0.1126,"rank":11,"tier":"W1"},
    {"word":"big","preset_hits":53,"banks":4,"uploaders":70,"sounds":923,"captions":12,"score":0.1087,"rank":12,"tier":"W1"},
    {"word":"hard","preset_hits":41,"banks":5,"uploaders":156,"sounds":759,"captions":23,"score":0.1086,"rank":13,"tier":"W1"},
    {"word":"weird","preset_hits":35,"banks":3,"uploaders":203,"sounds":1033,"captions":15,"score":0.1073,"rank":14,"tier":"W1"},
    {"word":"punchy","preset_hits":15,"banks":5,"uploaders":33,"sounds":346,"captions":219,"score":0.1063,"rank":15,"tier":"W1"},
    {"word":"lofi","preset_hits":48,"banks":5,"uploaders":110,"sounds":2543,"captions":1,"score":0.1015,"rank":16,"tier":"W1"},
    {"word":"shimmery","preset_hits":21,"banks":5,"uploaders":34,"sounds":94,"captions":132,"score":0.1001,"rank":17,"tier":"W1"},
    {"word":"glitchy","preset_hits":24,"banks":4,"uploaders":205,"sounds":3835,"captions":2,"score":0.0993,"rank":18,"tier":"W1"},
    {"word":"long","preset_hits":23,"banks":3,"uploaders":168,"sounds":1049,"captions":31,"score":0.0971,"rank":19,"tier":"W1"},
    {"word":"rhythmic","preset_hits":6,"banks":3,"uploaders":109,"sounds":441,"captions":113,"score":0.0924,"rank":20,"tier":"W1"},
    {"word":"energetic","preset_hits":0,"banks":0,"uploaders":10,"sounds":19,"captions":232,"score":0.0897,"rank":21,"tier":"W1"},
    {"word":"wide","preset_hits":18,"banks":3,"uploaders":37,"sounds":446,"captions":114,"score":0.0858,"rank":22,"tier":"W1"},
    {"word":"cinematic","preset_hits":18,"banks":4,"uploaders":168,"sounds":962,"captions":26,"score":0.0857,"rank":23,"tier":"W1"},
    {"word":"alien","preset_hits":34,"banks":6,"uploaders":145,"sounds":738,"captions":6,"score":0.0855,"rank":24,"tier":"W1"},
    {"word":"bright","preset_hits":39,"banks":4,"uploaders":59,"sounds":160,"captions":36,"score":0.0848,"rank":25,"tier":"W1"},
    {"word":"retro","preset_hits":23,"banks":4,"uploaders":150,"sounds":736,"captions":18,"score":0.0846,"rank":26,"tier":"W2"},
    {"word":"happy","preset_hits":18,"banks":4,"uploaders":97,"sounds":373,"captions":58,"score":0.0815,"rank":27,"tier":"W2"},
    {"word":"heavy","preset_hits":27,"banks":4,"uploaders":98,"sounds":316,"captions":26,"score":0.0781,"rank":28,"tier":"W2"},
    {"word":"experimental","preset_hits":5,"banks":2,"uploaders":171,"sounds":1471,"captions":18,"score":0.0761,"rank":29,"tier":"W2"},
    {"word":"fun","preset_hits":21,"banks":5,"uploaders":102,"sounds":324,"captions":32,"score":0.0745,"rank":30,"tier":"W2"},
    {"word":"strange","preset_hits":11,"banks":3,"uploaders":170,"sounds":876,"captions":1,"score":0.0728,"rank":31,"tier":"W2"},
    {"word":"dirty","preset_hits":40,"banks":5,"uploaders":51,"sounds":339,"captions":1,"score":0.0704,"rank":32,"tier":"W2"},
    {"word":"mellow","preset_hits":6,"banks":3,"uploaders":41,"sounds":213,"captions":110,"score":0.0701,"rank":33,"tier":"W2"},
    {"word":"robotic","preset_hits":20,"banks":4,"uploaders":121,"sounds":675,"captions":9,"score":0.0686,"rank":34,"tier":"W2"},
    {"word":"classic","preset_hits":36,"banks":4,"uploaders":56,"sounds":2643,"captions":6,"score":0.0675,"rank":35,"tier":"W2"},
    {"word":"loud","preset_hits":2,"banks":2,"uploaders":65,"sounds":232,"captions":78,"score":0.0658,"rank":36,"tier":"W2"},
    {"word":"glassy","preset_hits":36,"banks":6,"uploaders":30,"sounds":70,"captions":13,"score":0.0639,"rank":37,"tier":"W2"},
    {"word":"noisy","preset_hits":10,"banks":4,"uploaders":70,"sounds":575,"captions":52,"score":0.0637,"rank":38,"tier":"W2"},
    {"word":"scary","preset_hits":9,"banks":4,"uploaders":109,"sounds":315,"captions":26,"score":0.0618,"rank":39,"tier":"W2"},
    {"word":"funky","preset_hits":17,"banks":4,"uploaders":42,"sounds":487,"captions":55,"score":0.0613,"rank":40,"tier":"W2"},
    {"word":"suspenseful","preset_hits":5,"banks":3,"uploaders":90,"sounds":344,"captions":49,"score":0.0607,"rank":41,"tier":"W2"},
    {"word":"buzzy","preset_hits":15,"banks":4,"uploaders":75,"sounds":252,"captions":31,"score":0.0601,"rank":42,"tier":"W2"},
    {"word":"vintage","preset_hits":22,"banks":4,"uploaders":72,"sounds":37600,"captions":2,"score":0.0588,"rank":43,"tier":"W2"},
    {"word":"fat","preset_hits":29,"banks":4,"uploaders":49,"sounds":206,"captions":2,"score":0.0573,"rank":44,"tier":"W2"},
    {"word":"full","preset_hits":8,"banks":4,"uploaders":78,"sounds":588,"captions":34,"score":0.0572,"rank":45,"tier":"W2"},
    {"word":"emotional","preset_hits":5,"banks":4,"uploaders":17,"sounds":34,"captions":76,"score":0.056,"rank":46,"tier":"W2"},
    {"word":"sweet","preset_hits":24,"banks":4,"uploaders":46,"sounds":282,"captions":8,"score":0.0551,"rank":47,"tier":"W2"},
    {"word":"boomy","preset_hits":7,"banks":4,"uploaders":37,"sounds":109,"captions":56,"score":0.0531,"rank":48,"tier":"W2"},
    {"word":"bouncy","preset_hits":17,"banks":4,"uploaders":63,"sounds":651,"captions":22,"score":0.0517,"rank":49,"tier":"W2"},
    {"word":"upbeat","preset_hits":0,"banks":0,"uploaders":30,"sounds":70,"captions":84,"score":0.0512,"rank":50,"tier":"W2"},
    {"word":"repetitive","preset_hits":0,"banks":0,"uploaders":16,"sounds":49,"captions":92,"score":0.0509,"rank":51,"tier":"W2"},
    {"word":"futuristic","preset_hits":2,"banks":2,"uploaders":84,"sounds":326,"captions":31,"score":0.0508,"rank":52,"tier":"W2"},
    {"word":"smooth","preset_hits":14,"banks":4,"uploaders":62,"sounds":235,"captions":26,"score":0.0508,"rank":53,"tier":"W2"},
    {"word":"sad","preset_hits":14,"banks":5,"uploaders":67,"sounds":323,"captions":16,"score":0.0496,"rank":54,"tier":"W2"},
    {"word":"aggressive","preset_hits":5,"banks":2,"uploaders":14,"sounds":29,"captions":58,"score":0.0495,"rank":55,"tier":"W2"},
    {"word":"metallic","preset_hits":19,"banks":5,"uploaders":59,"sounds":200,"captions":11,"score":0.0494,"rank":56,"tier":"W2"},
    {"word":"warm","preset_hits":20,"banks":5,"uploaders":52,"sounds":724,"captions":13,"score":0.0493,"rank":57,"tier":"W2"},
    {"word":"creepy","preset_hits":5,"banks":3,"uploaders":103,"sounds":818,"captions":8,"score":0.0486,"rank":58,"tier":"W2"},
    {"word":"chill","preset_hits":12,"banks":3,"uploaders":71,"sounds":315,"captions":9,"score":0.0484,"rank":59,"tier":"W2"},
    {"word":"strong","preset_hits":9,"banks":3,"uploaders":26,"sounds":58,"captions":47,"score":0.0474,"rank":60,"tier":"W2"},